{
  "schema_version": "1.0",
  "sample_id": "dev01-gptsovits-full_6345_93306_000056_000002",
  "category": "fullspoof",
  "utterance_label": "spoof",
  "audio": {
    "path": "samples/audio/dev01-gptsovits-full_6345_93306_000056_000002.wav",
    "duration_sec": 14.86,
    "sample_rate_hz": 16000,
    "channels": 1,
    "num_samples": 237760,
    "bits_per_sample": 16,
    "sha256": "eab2e90ecacbdc8e44c6e3fe0c2deb30019254c33b7ad4940d7556ad62195b9d"
  },
  "source": {
    "dataset": "LlamaPartialSpoof",
    "version": "1.0.b",
    "record_url": "https://zenodo.org/records/14214149",
    "original_id": "dev01-gptsovits-full_6345_93306_000056_000002",
    "original_split": "not_defined",
    "release_part": "R01TTS.0.a",
    "speaker_id": null,
    "reference_speaker_key": "6345",
    "attack_id": "gptsovits",
    "attack_name": "gptsovits",
    "source_audio_relative_path": "R01TTS.0.a/dev01-gptsovits-full_6345_93306_000056_000002.wav",
    "protocol_line": "dev01-gptsovits-full_6345_93306_000056_000002 14.8600 spoof 0.0000-14.8600-spoof"
  },
  "annotation": {
    "status": "official_temporal_annotations",
    "time_unit": "seconds",
    "interval_convention": "[start,end)",
    "origin_sec": 0,
    "non_speech_annotation_available": false,
    "source_file": "samples/labels/original/dev01-gptsovits-full_6345_93306_000056_000002.label.txt",
    "source_sha256": "70c83eb35b353eedc78d249bec94097cc8e7f9b7f37c66b353c23d8f72ceaa45",
    "source_duration_sec": 14.86,
    "normalizations": [],
    "annotated_duration_sec": 14.86,
    "unannotated_duration_sec": 0.0
  },
  "segments": [
    {
      "index": 0,
      "start_sec": 0.0,
      "end_sec": 14.86,
      "label": "spoof",
      "source_label": "spoof",
      "source_start_sec": 0.0,
      "source_end_sec": 14.86
    }
  ],
  "summary": {
    "spoof_segment_count": 1,
    "spoof_duration_sec": 14.86,
    "bonafide_segment_count": 0,
    "bonafide_duration_sec": 0.0,
    "non_speech_segment_count": 0,
    "non_speech_duration_sec": 0.0,
    "unannotated_segment_count": 0,
    "unannotated_duration_sec": 0.0,
    "spoof_ratio_total_duration": 1.0,
    "spoof_ratio_annotated_speech": null
  }
}
