{
  "schema_version": "1.0",
  "sample_id": "dev01-xttsv2-full_1462_170138_000003_000005",
  "category": "fullspoof",
  "utterance_label": "spoof",
  "audio": {
    "path": "samples/audio/dev01-xttsv2-full_1462_170138_000003_000005.wav",
    "duration_sec": 2.5066875,
    "sample_rate_hz": 16000,
    "channels": 1,
    "num_samples": 40107,
    "bits_per_sample": 16,
    "sha256": "052fa442e65882d5975297b0224c688ee0670d56ca20cdb7756e5ba688552474"
  },
  "source": {
    "dataset": "LlamaPartialSpoof",
    "version": "1.0.b",
    "record_url": "https://zenodo.org/records/14214149",
    "original_id": "dev01-xttsv2-full_1462_170138_000003_000005",
    "original_split": "not_defined",
    "release_part": "R01TTS.0.a",
    "speaker_id": null,
    "reference_speaker_key": "1462",
    "attack_id": "xttsv2",
    "attack_name": "xttsv2",
    "source_audio_relative_path": "R01TTS.0.a/dev01-xttsv2-full_1462_170138_000003_000005.wav",
    "protocol_line": "dev01-xttsv2-full_1462_170138_000003_000005 2.5067 spoof 0.0000-2.5067-spoof"
  },
  "annotation": {
    "status": "official_temporal_annotations",
    "time_unit": "seconds",
    "interval_convention": "[start,end)",
    "origin_sec": 0,
    "non_speech_annotation_available": false,
    "source_file": "samples/labels/original/dev01-xttsv2-full_1462_170138_000003_000005.label.txt",
    "source_sha256": "ae36c679ba997f4aef4cefb67dd6524714adb09b067e88370c0f69dabd3d25fc",
    "source_duration_sec": 2.5067,
    "normalizations": [
      {
        "type": "rounded_terminal_boundary_to_audio_duration",
        "original_end_sec": 2.5067,
        "normalized_end_sec": 2.5066875,
        "delta_sec": -1.2499999999970868e-05,
        "reason": "官方标签保留四位小数；完整伪造区间末端按 WAV 实测时长对齐，差值不超过 0.00005 秒。"
      }
    ],
    "annotated_duration_sec": 2.5066875,
    "unannotated_duration_sec": 0.0
  },
  "segments": [
    {
      "index": 0,
      "start_sec": 0.0,
      "end_sec": 2.5066875,
      "label": "spoof",
      "source_label": "spoof",
      "source_start_sec": 0.0,
      "source_end_sec": 2.5067
    }
  ],
  "summary": {
    "spoof_segment_count": 1,
    "spoof_duration_sec": 2.5066875,
    "bonafide_segment_count": 0,
    "bonafide_duration_sec": 0.0,
    "non_speech_segment_count": 0,
    "non_speech_duration_sec": 0.0,
    "unannotated_segment_count": 0,
    "unannotated_duration_sec": 0.0,
    "spoof_ratio_total_duration": 1.0,
    "spoof_ratio_annotated_speech": null
  }
}
