{
  "schema_version": "1.0",
  "sample_id": "dev01-yourtts-full_6241_61943_000003_000000",
  "category": "fullspoof",
  "utterance_label": "spoof",
  "audio": {
    "path": "samples/audio/dev01-yourtts-full_6241_61943_000003_000000.wav",
    "duration_sec": 2.113,
    "sample_rate_hz": 16000,
    "channels": 1,
    "num_samples": 33808,
    "bits_per_sample": 16,
    "sha256": "fec752e4734315c654e00838ec6fb3e55ec706806eb087c14e78cf38324a379e"
  },
  "source": {
    "dataset": "LlamaPartialSpoof",
    "version": "1.0.b",
    "record_url": "https://zenodo.org/records/14214149",
    "original_id": "dev01-yourtts-full_6241_61943_000003_000000",
    "original_split": "not_defined",
    "release_part": "R01TTS.0.a",
    "speaker_id": null,
    "reference_speaker_key": "6241",
    "attack_id": "yourtts",
    "attack_name": "yourtts",
    "source_audio_relative_path": "R01TTS.0.a/dev01-yourtts-full_6241_61943_000003_000000.wav",
    "protocol_line": "dev01-yourtts-full_6241_61943_000003_000000 2.1130 spoof 0.0000-2.1130-spoof"
  },
  "annotation": {
    "status": "official_temporal_annotations",
    "time_unit": "seconds",
    "interval_convention": "[start,end)",
    "origin_sec": 0,
    "non_speech_annotation_available": false,
    "source_file": "samples/labels/original/dev01-yourtts-full_6241_61943_000003_000000.label.txt",
    "source_sha256": "8091d0b3827754876beeafc570e8c54f29fac99b6bd3b829ee0b0bc660e91d90",
    "source_duration_sec": 2.113,
    "normalizations": [],
    "annotated_duration_sec": 2.113,
    "unannotated_duration_sec": 0.0
  },
  "segments": [
    {
      "index": 0,
      "start_sec": 0.0,
      "end_sec": 2.113,
      "label": "spoof",
      "source_label": "spoof",
      "source_start_sec": 0.0,
      "source_end_sec": 2.113
    }
  ],
  "summary": {
    "spoof_segment_count": 1,
    "spoof_duration_sec": 2.113,
    "bonafide_segment_count": 0,
    "bonafide_duration_sec": 0.0,
    "non_speech_segment_count": 0,
    "non_speech_duration_sec": 0.0,
    "unannotated_segment_count": 0,
    "unannotated_duration_sec": 0.0,
    "spoof_ratio_total_duration": 1.0,
    "spoof_ratio_annotated_speech": null
  }
}
