{
  "schema_version": "1.0",
  "sample_id": "dev01-ljjets-full_2803_154328_000069_000000",
  "category": "fullspoof",
  "utterance_label": "spoof",
  "audio": {
    "path": "samples/audio/dev01-ljjets-full_2803_154328_000069_000000.wav",
    "duration_sec": 5.0155,
    "sample_rate_hz": 16000,
    "channels": 1,
    "num_samples": 80248,
    "bits_per_sample": 16,
    "sha256": "466bdc95b2a1904d332020a625789e0c4a307e2ca2e30a96c4c16e2571d082d9"
  },
  "source": {
    "dataset": "LlamaPartialSpoof",
    "version": "1.0.b",
    "record_url": "https://zenodo.org/records/14214149",
    "original_id": "dev01-ljjets-full_2803_154328_000069_000000",
    "original_split": "not_defined",
    "release_part": "R01TTS.0.a",
    "speaker_id": null,
    "reference_speaker_key": "2803",
    "attack_id": "ljjets",
    "attack_name": "ljjets",
    "source_audio_relative_path": "R01TTS.0.a/dev01-ljjets-full_2803_154328_000069_000000.wav",
    "protocol_line": "dev01-ljjets-full_2803_154328_000069_000000 5.0155 spoof 0.0000-5.0155-spoof"
  },
  "annotation": {
    "status": "official_temporal_annotations",
    "time_unit": "seconds",
    "interval_convention": "[start,end)",
    "origin_sec": 0,
    "non_speech_annotation_available": false,
    "source_file": "samples/labels/original/dev01-ljjets-full_2803_154328_000069_000000.label.txt",
    "source_sha256": "7486096e3eb7afecac612c2b77f6829fdf90313bf9526dd982110ff9eb48d066",
    "source_duration_sec": 5.0155,
    "normalizations": [],
    "annotated_duration_sec": 5.0155,
    "unannotated_duration_sec": 0.0
  },
  "segments": [
    {
      "index": 0,
      "start_sec": 0.0,
      "end_sec": 5.0155,
      "label": "spoof",
      "source_label": "spoof",
      "source_start_sec": 0.0,
      "source_end_sec": 5.0155
    }
  ],
  "summary": {
    "spoof_segment_count": 1,
    "spoof_duration_sec": 5.0155,
    "bonafide_segment_count": 0,
    "bonafide_duration_sec": 0.0,
    "non_speech_segment_count": 0,
    "non_speech_duration_sec": 0.0,
    "unannotated_segment_count": 0,
    "unannotated_duration_sec": 0.0,
    "spoof_ratio_total_duration": 1.0,
    "spoof_ratio_annotated_speech": null
  }
}
